<?xml version="1.0" encoding="UTF-8"?>

<cursisten	xmlns="http://www.vdab.be/cursisten"
			xmlns:xsi="http://www.w3.org/2001/XMLSchema-instance"
			xsi:schemaLocation="http://www.vdab.be/cursisten cursisten.xsd">
	<cursist>
		<voornaam>Joe</voornaam>
		<familienaam>Dalton</familienaam>
		<email>joe@daltons.org</email>
		<geboortedatum>1966-08-01</geboortedatum>
		<traject>Java</traject>
	</cursist>
	<cursist>
		<voornaam>Jack</voornaam>
		<familienaam>Dalton</familienaam>
		<email>jack@daltons.org</email>
		<geboortedatum>1964-08-28</geboortedatum>
		<traject>C#</traject>
	</cursist>
	<cursist>
		<voornaam>Lucky</voornaam>
		<familienaam>Luke</familienaam>
		<email>lucky.luke@goodones.org</email>
		<geboortedatum>1965-01-31</geboortedatum>
		<traject>PHP</traject>
	</cursist>
</cursisten>